{
  "$schema": "https://json-schema.org/draft/2020-12/schema",
  "title": "vaults.json — registry data projection",
  "description": "Generated by aDNA.aDNA/scripts/build_vaults_data.mjs. Canonical contract per ADR-023.",
  "type": "object",
  "required": ["schema_version", "vault_count", "vaults", "edges"],
  "properties": {
    "schema_version": { "type": "string", "const": "0.2" },
    "source_inventory_sha": { "type": "string", "pattern": "^[a-f0-9]{16}$" },
    "generated_at": { "type": "string", "format": "date" },
    "vault_count": { "type": "integer", "minimum": 0 },
    "vaults": {
      "type": "array",
      "items": {
        "type": "object",
        "required": ["vault", "vault_slug", "display_name", "class", "status"],
        "properties": {
          "vault": { "type": "string" },
          "vault_slug": { "type": "string", "pattern": "^[a-z0-9_-]+$" },
          "display_name": { "type": "string" },
          "full_name": { "type": ["string", "null"] },
          "tagline": { "type": ["string", "null"] },
          "class": { "type": "string" },
          "subclass": { "type": ["string", "null"] },
          "persona": { "type": ["string", "null"] },
          "persona_archetype": { "type": ["string", "null"] },
          "status": { "type": "string" },
          "lifecycle_stage": { "type": ["string", "null"] },
          "current_phase": { "type": ["string", "null"] },
          "headline_mission": { "type": ["string", "null"] },
          "headline_mission_state": { "type": ["string", "null"] },
          "recent_closed": { "type": "array", "items": { "type": "string" } },
          "headline_adrs": { "type": "array", "items": { "type": "string" } },
          "umbrella_pillar": { "type": ["array", "string", "null"] },
          "companion_vaults": { "type": "array", "items": { "type": "string" } },
          "federation_refs": { "type": "array", "items": { "type": "string" } },
          "supersedes": { "type": ["string", "null"] },
          "superseded_by": { "type": ["string", "null"] },
          "default_partners": { "type": "array", "items": { "type": "string" } },
          "github_url": { "type": ["string", "null"] },
          "docs_site_url": { "type": ["string", "null"] },
          "canonical_governance": { "type": ["string", "null"] },
          "last_synced": { "type": ["string", "null"] },
          "note": { "type": ["string", "null"] },
          "schema_version": { "type": "string" },
          "card_present": { "type": "boolean" }
        }
      }
    },
    "edges": {
      "type": "array",
      "items": {
        "type": "object",
        "required": ["source", "target", "type"],
        "properties": {
          "source": { "type": ["string", "null"] },
          "target": { "type": ["string", "null"] },
          "type": { "type": "string", "enum": ["umbrella", "companion", "federation", "partner", "supersedes"] }
        }
      }
    }
  }
}
