{
  "edges": [
    {
      "source": "molecules",
      "target": "astro",
      "type": "federation"
    },
    {
      "source": "sciencestanley",
      "target": "oration",
      "type": "federation"
    },
    {
      "source": "sciencestanley",
      "target": "visualdna",
      "type": "federation"
    },
    {
      "source": "wilhelmai",
      "target": "astro",
      "type": "federation"
    },
    {
      "source": "wilhelmai",
      "target": "iii",
      "type": "federation"
    },
    {
      "source": "wilhelmai",
      "target": "rarearchive",
      "type": "umbrella"
    },
    {
      "source": "zenzachary",
      "target": "sciencestanley",
      "type": "companion"
    },
    {
      "source": "zenzachary",
      "target": "visualdna",
      "type": "federation"
    },
    {
      "source": "harness",
      "target": "astro",
      "type": "federation"
    },
    {
      "source": "harness",
      "target": "iii",
      "type": "federation"
    },
    {
      "source": "remotecontrol",
      "target": "terminal",
      "type": "companion"
    },
    {
      "source": "tappprotocol",
      "target": "molecules",
      "type": "companion"
    },
    {
      "source": "tappprotocol",
      "target": "vaas",
      "type": "companion"
    },
    {
      "source": "adna",
      "target": "iii",
      "type": "federation"
    }
  ],
  "generated_at": "2026-10-16",
  "schema_version": "0.2",
  "source_inventory_sha": "35b254b434ad653f",
  "vault_count": 74,
  "vaults": [
    {
      "canonical_governance": "Operations.aDNA/AGENTS.md",
      "card_present": true,
      "class": "coordination",
      "companion_vaults": [],
      "current_phase": null,
      "default_partners": [],
      "display_name": "Operations",
      "docs_site_url": null,
      "federation_refs": [],
      "full_name": null,
      "github_url": null,
      "headline_adrs": [],
      "headline_mission": null,
      "headline_mission_state": null,
      "last_synced": "2026-05-29",
      "lifecycle_stage": null,
      "note": "Coordination substrate for a node: the shared task ontology and the claim-lease service that let several agents and vaults divide work without colliding.",
      "persona": "Berthier",
      "persona_archetype": "berthier",
      "recent_closed": [],
      "schema_version": "0.2",
      "status": "active",
      "subclass": null,
      "superseded_by": null,
      "supersedes": null,
      "tagline": "The network's shared task fabric — a canonical task ontology + claim-lease federation so agents coordinate work without colliding.",
      "umbrella_pillar": null,
      "vault": "Operations.aDNA",
      "vault_slug": "operations"
    },
    {
      "canonical_governance": "Astro.aDNA/CLAUDE.md",
      "card_present": true,
      "class": "forge",
      "companion_vaults": [],
      "current_phase": null,
      "default_partners": [],
      "display_name": "Astro",
      "docs_site_url": null,
      "federation_refs": [],
      "full_name": null,
      "github_url": null,
      "headline_adrs": [],
      "headline_mission": null,
      "headline_mission_state": null,
      "last_synced": "2026-05-24",
      "lifecycle_stage": null,
      "note": "Astro 6 composable website builder; Production v1.0.",
      "persona": null,
      "persona_archetype": null,
      "recent_closed": [],
      "schema_version": "0.2",
      "status": "active",
      "subclass": null,
      "superseded_by": null,
      "supersedes": null,
      "tagline": "A composable Astro 6 website builder — archetypes, lattice graphs, and quality gates that assemble production sites fast.",
      "umbrella_pillar": null,
      "vault": "Astro.aDNA",
      "vault_slug": "astro"
    },
    {
      "canonical_governance": "ComfyUI.aDNA/CLAUDE.md",
      "card_present": true,
      "class": "forge",
      "companion_vaults": [],
      "current_phase": null,
      "default_partners": [],
      "display_name": "ComfyUI",
      "docs_site_url": null,
      "federation_refs": [],
      "full_name": null,
      "github_url": null,
      "headline_adrs": [],
      "headline_mission": null,
      "headline_mission_state": null,
      "last_synced": "2026-05-24",
      "lifecycle_stage": null,
      "note": null,
      "persona": null,
      "persona_archetype": null,
      "recent_closed": [],
      "schema_version": "0.2",
      "status": "pending",
      "subclass": null,
      "superseded_by": null,
      "supersedes": null,
      "tagline": "A visual-generation forge on ComfyUI — reusable image/video workflows, models, and LoRA training wired into the network's pipelines.",
      "umbrella_pillar": null,
      "vault": "ComfyUI.aDNA",
      "vault_slug": "comfyui"
    },
    {
      "canonical_governance": "D3.aDNA/CLAUDE.md",
      "card_present": true,
      "class": "forge",
      "companion_vaults": [],
      "current_phase": null,
      "default_partners": [],
      "display_name": "D3",
      "docs_site_url": null,
      "federation_refs": [],
      "full_name": null,
      "github_url": null,
      "headline_adrs": [],
      "headline_mission": null,
      "headline_mission_state": null,
      "last_synced": "2026-08-29",
      "lifecycle_stage": null,
      "note": "Build-face software-element context graph.",
      "persona": "Playfair",
      "persona_archetype": "playfair",
      "recent_closed": [],
      "schema_version": "0.2",
      "status": "genesis",
      "subclass": null,
      "superseded_by": null,
      "supersedes": null,
      "tagline": "The network's D3.js build material — context for authoring, composing, and validating data visualizations on the web stack.",
      "umbrella_pillar": null,
      "vault": "D3.aDNA",
      "vault_slug": "d3"
    },
    {
      "canonical_governance": "LlamaCppForge.aDNA/CLAUDE.md",
      "card_present": true,
      "class": "forge",
      "companion_vaults": [],
      "current_phase": null,
      "default_partners": [],
      "display_name": "LlamaCppForge",
      "docs_site_url": null,
      "federation_refs": [],
      "full_name": null,
      "github_url": null,
      "headline_adrs": [],
      "headline_mission": null,
      "headline_mission_state": null,
      "last_synced": "2026-08-29",
      "lifecycle_stage": null,
      "note": "Forge.aDNA software-element context graph for building/optimizing/generating with llama.cpp (build-with face; the root llama.cpp external dep is the upstream).",
      "persona": "Hephaestus",
      "persona_archetype": "hephaestus",
      "recent_closed": [],
      "schema_version": "0.2",
      "status": "genesis",
      "subclass": null,
      "superseded_by": null,
      "supersedes": null,
      "tagline": "The llama.cpp build-face — GGUF conversion, quantization, and LoRA tooling for running models on your own metal.",
      "umbrella_pillar": null,
      "vault": "LlamaCppForge.aDNA",
      "vault_slug": "llamacppforge"
    },
    {
      "canonical_governance": "Molecules.aDNA/CLAUDE.md",
      "card_present": true,
      "class": "forge",
      "companion_vaults": [],
      "current_phase": null,
      "default_partners": [],
      "display_name": "Molecules",
      "docs_site_url": null,
      "federation_refs": [
        "Astro.aDNA"
      ],
      "full_name": null,
      "github_url": null,
      "headline_adrs": [],
      "headline_mission": null,
      "headline_mission_state": null,
      "last_synced": "2026-05-24",
      "lifecycle_stage": null,
      "note": null,
      "persona": "Franklin",
      "persona_archetype": "franklin",
      "recent_closed": [],
      "schema_version": "0.2",
      "status": "genesis",
      "subclass": null,
      "superseded_by": null,
      "supersedes": null,
      "tagline": null,
      "umbrella_pillar": null,
      "vault": "Molecules.aDNA",
      "vault_slug": "molecules"
    },
    {
      "canonical_governance": "Oration.aDNA/CLAUDE.md",
      "card_present": true,
      "class": "forge",
      "companion_vaults": [],
      "current_phase": null,
      "default_partners": [],
      "display_name": "Oration",
      "docs_site_url": null,
      "federation_refs": [],
      "full_name": null,
      "github_url": null,
      "headline_adrs": [],
      "headline_mission": null,
      "headline_mission_state": null,
      "last_synced": "2026-05-24",
      "lifecycle_stage": null,
      "note": "Greene-methodology speech-package pipeline (8-stage; 3 human gates). v0.2.0 post-C7 extraction. Phase-1+ awaits operator gate.",
      "persona": "Robert Kennedy",
      "persona_archetype": "robert_kennedy",
      "recent_closed": [],
      "schema_version": "0.2",
      "status": "genesis",
      "subclass": null,
      "superseded_by": null,
      "supersedes": null,
      "tagline": "An 8-stage speech pipeline in the Robert Greene method — raw idea to delivery-ready oration, with human gates at the turns.",
      "umbrella_pillar": null,
      "vault": "Oration.aDNA",
      "vault_slug": "oration"
    },
    {
      "canonical_governance": "Regenesis.aDNA/CLAUDE.md",
      "card_present": true,
      "class": "forge",
      "companion_vaults": [],
      "current_phase": null,
      "default_partners": [],
      "display_name": "Regenesis",
      "docs_site_url": null,
      "federation_refs": [],
      "full_name": null,
      "github_url": null,
      "headline_adrs": [],
      "headline_mission": null,
      "headline_mission_state": null,
      "last_synced": "2026-08-29",
      "lifecycle_stage": null,
      "note": null,
      "persona": "Persephone",
      "persona_archetype": "persephone",
      "recent_closed": [],
      "schema_version": "0.2",
      "status": "genesis",
      "subclass": null,
      "superseded_by": null,
      "supersedes": null,
      "tagline": "A genome-seeded regeneration forge — generative worlds grown from genomic seeds.",
      "umbrella_pillar": null,
      "vault": "Regenesis.aDNA",
      "vault_slug": "regenesis"
    },
    {